{
  "contract": "policy-content/v1",
  "id": "doc/lobbying-certification",
  "version": "2005-01",
  "title": "Certification Regarding Lobbying",
  "kind": "certification",
  "sources": [
    {
      "id": "cd511-readonly-pdf",
      "type": "pdf",
      "uri": "https://apply07.grants.gov/apply/forms/readonly/CD511-V1.1.pdf",
      "sha256": "9c77e249ecb0755f6e000eaa0becd9f6a459fe91adf766f2c64e898d6253d92e",
      "retrievedAt": "2026-08-23T20:00:00Z",
      "note": "Official Grants.gov read-only CD-511 form (Form CD-511, revision 1-05)."
    }
  ],
  "sections": [
    {
      "id": "certification-directions",
      "role": "informational",
      "title": "CERTIFICATION REGARDING LOBBYING",
      "text": "Applicants should also review the instructions for certification included in the regulations before completing this form. Signature on this form provides for compliance with certification requirements under 15 CFR Part 28, 'New Restrictions on Lobbying.' The certifications shall be treated as a material representation of fact upon which reliance will be placed when the Department of Commerce determines to award the covered transaction, grant, or cooperative agreement.",
      "sourceRefs": [{ "sourceId": "cd511-readonly-pdf", "locator": "page 1, introductory paragraph" }]
    },
    {
      "id": "lobbying",
      "role": "certification",
      "title": "Lobbying",
      "preamble": "As required by Section 1352, Title 31 of the U.S. Code, and implemented at 15 CFR Part 28, for persons entering into a grant, cooperative agreement or contract over $100,000 or a loan or loan guarantee over $150,000 as defined at 15 CFR Part 28, Sections 28.105 and 28.110, the applicant certifies that to the best of his or her knowledge and belief, that:",
      "items": [
        {
          "id": "no-federal-funds",
          "ordinal": 1,
          "text": "No Federal appropriated funds have been paid or will be paid, by or on behalf of the undersigned, to any person for influencing or attempting to influence an officer or employee of any agency, a Member of Congress in connection with the awarding of any Federal contract, the making of any Federal grant, the making of any Federal loan, the entering into of any cooperative agreement, and the extension, continuation, renewal, amendment, or modification of any Federal contract, grant, loan, or cooperative agreement.",
          "sourceRefs": [{ "sourceId": "cd511-readonly-pdf", "locator": "page 1, Lobbying item 1" }]
        },
        {
          "id": "non-federal-funds-disclosure",
          "ordinal": 2,
          "text": "If any funds other than Federal appropriated funds have been paid or will be paid to any person for influencing or attempting to influence an officer or employee of any agency, a Member of Congress, an officer or employee of Congress, or an employee of a member of Congress in connection with this Federal contract, grant, loan, or cooperative agreement, the undersigned shall complete and submit Standard Form-LLL, 'Disclosure Form to Report Lobbying.' in accordance with its instructions.",
          "sourceRefs": [{ "sourceId": "cd511-readonly-pdf", "locator": "page 1, Lobbying item 2" }]
        },
        {
          "id": "flow-down",
          "ordinal": 3,
          "text": "The undersigned shall require that the language of this certification be included in the award documents for all subawards at all tiers (including subcontracts, subgrants, and contracts under grants, loans, and cooperative agreements) and that all subrecipients shall certify and disclose accordingly.",
          "sourceRefs": [{ "sourceId": "cd511-readonly-pdf", "locator": "page 1, Lobbying item 3" }]
        }
      ],
      "note": "This certification is a material representation of fact upon which reliance was placed when this transaction was made or entered into. Submission of this certification is a prerequisite for making or entering into this transaction imposed by section 1352, title 31, U.S. Code. Any person who fails to file the required certification shall be subject to a civil penalty of not less than $10,000 and not more than $100,000 for each such failure occurring on or before October 23, 1996, and of not less than $11,000 and not more than $110,000 for each such failure occurring after October 23, 1996.",
      "sourceRefs": [{ "sourceId": "cd511-readonly-pdf", "locator": "page 1, Lobbying column" }]
    },
    {
      "id": "loan-guarantees",
      "role": "certification",
      "title": "Statement for Loan Guarantees and Loan Insurance",
      "text": "The undersigned states, to the best of his or her knowledge and belief, that:\n\nIn any funds have been paid or will be paid to any person for influencing or attempting to influence an officer or employee of any agency, a Member of Congress, an officer or employee of Congress, or an employee of a Member of Congress in connection with this commitment providing for the United States to insure or guarantee a loan, the undersigned shall complete and submit Standard Form-LLL, 'Disclosure Form to Report Lobbying,' in accordance with its instructions.\n\nSubmission of this statement is a prerequisite for making or entering into this transaction imposed by section 1352, title 31, U.S. Code. Any person who fails to file the required statement shall be subject to a civil penalty of not less than $10,000 and not more than $100,000 for each such failure occurring on or before October 23, 1996, and of not less than $11,000 and not more than $110,000 for each such failure occurring after October 23, 1996.",
      "sourceRefs": [{ "sourceId": "cd511-readonly-pdf", "locator": "page 1, Statement for Loan Guarantees and Loan Insurance" }]
    },
    {
      "id": "acknowledgement",
      "role": "assurance",
      "title": "Acknowledgement",
      "text": "As the duly authorized representative of the applicant, I hereby certify that the applicant will comply with the above applicable certification.",
      "sourceRefs": [{ "sourceId": "cd511-readonly-pdf", "locator": "page 1, acknowledgement above applicant fields" }]
    }
  ]
}
